{
  "$schema": "https://opengalois.org/schemas/certificate/3.0.0.json",
  "meta": {
    "schema_version": "3.0.0",
    "generator": "fixture",
    "generator_version": "0",
    "backend": "none",
    "ruleset_id": "le5-core@1"
  },
  "input": {
    "domain": "Q",
    "variable": "x",
    "ordering": "descending_degree",
    "degree": 4,
    "coeffs_qq": [
      "1",
      "0",
      "0",
      "5",
      "5"
    ],
    "canonicalization": "jcs-rfc8785",
    "hash_alg": "sha256",
    "hash_scope": "input_v1",
    "hash": "1174ff64142fa72623b14f4b052ab24bc9ef45b2afe0bfb43ce842fbc0963ce7"
  },
  "objects": {
    "int.deg4": {
      "kind": "IntZ",
      "value": "4"
    },
    "rat.disc.1": {
      "kind": "RatQQ",
      "value": "15125"
    },
    "poly.resolvent.1": {
      "kind": "PolyQQ",
      "coeffs_qq": [
        "1",
        "0",
        "-20",
        "-25"
      ]
    },
    "mpoly.resolvent.deg4.cubic_x1x2_plus_x3x4": {
      "kind": "MPolyQQ",
      "nvars": 4,
      "terms": [
        {
          "exp": [
            1,
            1,
            0,
            0
          ],
          "coeff_qq": "1"
        },
        {
          "exp": [
            0,
            0,
            1,
            1
          ],
          "coeff_qq": "1"
        }
      ]
    },
    "rat.unit.1": {
      "kind": "RatQQ",
      "value": "1"
    },
    "poly.factor.lin": {
      "kind": "PolyQQ",
      "coeffs_qq": [
        "1",
        "-5"
      ]
    },
    "poly.factor.quad": {
      "kind": "PolyQQ",
      "coeffs_qq": [
        "1",
        "5",
        "5"
      ]
    },
    "polylist.factors.1": {
      "kind": "PolyQQList",
      "items": [
        "poly.factor.lin",
        "poly.factor.quad"
      ]
    },
    "rat.w1": {
      "kind": "RatQQ",
      "value": "302500"
    },
    "rat.w1sqrt": {
      "kind": "RatQQ",
      "value": "550"
    },
    "rat.w2": {
      "kind": "RatQQ",
      "value": "75625"
    },
    "rat.w2sqrt": {
      "kind": "RatQQ",
      "value": "275"
    },
    "grp.target": {
      "kind": "GroupId",
      "system": "smallgroup",
      "order": 4,
      "index": 1,
      "alias": "C4"
    }
  },
  "proof": {
    "version": "1.0",
    "facts": [
      {
        "id": "F1",
        "claim": {
          "pred": "Degree",
          "args": [
            {
              "ref": "$input"
            },
            {
              "ref": "int.deg4"
            }
          ]
        },
        "rule": "degree.QQ@1",
        "premises": [],
        "statement": "Degree of the input quartic."
      },
      {
        "id": "F2",
        "claim": {
          "pred": "IrreducibleQQ",
          "args": [
            {
              "ref": "$input"
            }
          ]
        },
        "rule": "irreducible.QQ.deg5_recompute@1",
        "premises": [
          "F1"
        ],
        "statement": "Irreducible quartic over QQ."
      },
      {
        "id": "F3",
        "claim": {
          "pred": "Discriminant",
          "args": [
            {
              "ref": "$input"
            },
            {
              "ref": "rat.disc.1"
            }
          ]
        },
        "rule": "disc.QQ.compute@1",
        "premises": [],
        "statement": "Quartic discriminant."
      },
      {
        "id": "F4",
        "claim": {
          "pred": "NonSquareQQ",
          "args": [
            {
              "ref": "rat.disc.1"
            }
          ]
        },
        "rule": "nonsquare.QQ.isqrt@1",
        "premises": [],
        "statement": "Quartic discriminant is not a square."
      },
      {
        "id": "F5",
        "claim": {
          "pred": "DiscNonSquareQQ",
          "args": [
            {
              "ref": "$input"
            }
          ]
        },
        "rule": "disc.nonsquare.QQ.lift@1",
        "premises": [
          "F3",
          "F4"
        ],
        "statement": "Quartic discriminant non-square branch."
      },
      {
        "id": "F6",
        "claim": {
          "pred": "ResolventQQ",
          "args": [
            {
              "ref": "poly.resolvent.1"
            },
            {
              "ref": "$input"
            },
            {
              "ref": "mpoly.resolvent.deg4.cubic_x1x2_plus_x3x4"
            }
          ]
        },
        "rule": "resolvent.QQ.compute.deg4.cubic_x1x2_plus_x3x4@1",
        "premises": [
          "F1"
        ],
        "statement": "Quartic cubic resolvent."
      },
      {
        "id": "F7",
        "claim": {
          "pred": "FactorizationMonicQQ",
          "args": [
            {
              "ref": "poly.resolvent.1"
            },
            {
              "ref": "polylist.factors.1"
            },
            {
              "ref": "rat.unit.1"
            }
          ]
        },
        "rule": "factorization.QQ.monic@1",
        "premises": [],
        "statement": "Resolvent factorization with exactly one rational root."
      },
      {
        "id": "F8",
        "claim": {
          "pred": "SqrtQQ",
          "args": [
            {
              "ref": "rat.w1"
            },
            {
              "ref": "rat.w1sqrt"
            }
          ]
        },
        "rule": "sqrt.QQ.check@1",
        "premises": [],
        "statement": "Square root witness for the first auxiliary value."
      },
      {
        "id": "F9",
        "claim": {
          "pred": "IsSquareQQ",
          "args": [
            {
              "ref": "rat.w1"
            }
          ]
        },
        "rule": "is_square.QQ.lift@1",
        "premises": [
          "F8"
        ],
        "statement": "First auxiliary value is a square in QQ."
      },
      {
        "id": "F10",
        "claim": {
          "pred": "SqrtQQ",
          "args": [
            {
              "ref": "rat.w2"
            },
            {
              "ref": "rat.w2sqrt"
            }
          ]
        },
        "rule": "sqrt.QQ.check@1",
        "premises": [],
        "statement": "Square root witness for the second auxiliary value."
      },
      {
        "id": "F11",
        "claim": {
          "pred": "IsSquareQQ",
          "args": [
            {
              "ref": "rat.w2"
            }
          ]
        },
        "rule": "is_square.QQ.lift@1",
        "premises": [
          "F10"
        ],
        "statement": "Second auxiliary value is a square in QQ."
      },
      {
        "id": "F12",
        "claim": {
          "pred": "GaloisGroup",
          "args": [
            {
              "ref": "$input"
            },
            {
              "ref": "grp.target"
            }
          ]
        },
        "rule": "galois_group.QQ.deg4.C4@1",
        "premises": [
          "F1",
          "F2",
          "F3",
          "F5",
          "F6",
          "F7",
          "F9",
          "F11"
        ],
        "statement": "Quartic Galois-group classification (C4 branch)."
      }
    ]
  }
}