{
  "$schema": "https://opengalois.org/schemas/certificate/3.0.0.json",
  "meta": {
    "schema_version": "3.0.0",
    "generator": "fixture",
    "backend": "sympy",
    "ruleset_id": "le5-core@1"
  },
  "input": {
    "domain": "Q",
    "variable": "x",
    "ordering": "descending_degree",
    "degree": 2,
    "coeffs_qq": [
      "1",
      "2",
      "3"
    ],
    "canonicalization": "jcs-rfc8785",
    "hash_alg": "sha256",
    "hash_scope": "input_v1",
    "hash": "10f00ead2632129d847438bb45a312b749f33b26d76237d880d06c5f318a2a7b"
  },
  "objects": {
    "poly.g": {
      "kind": "PolyQQ",
      "coeffs_qq": [
        "1",
        "0",
        "2"
      ]
    },
    "int.2": {
      "kind": "IntZ",
      "value": "2"
    },
    "grp.C2": {
      "kind": "GroupId",
      "system": "smallgroup",
      "order": 2,
      "index": 1,
      "alias": "C2"
    }
  },
  "proof": {
    "version": "1.0",
    "goals": [
      "F6"
    ],
    "facts": [
      {
        "id": "F1",
        "claim": {
          "pred": "Degree",
          "args": [
            {
              "ref": "$input"
            },
            {
              "ref": "int.2"
            }
          ]
        },
        "rule": "degree.QQ@1"
      },
      {
        "id": "F2",
        "claim": {
          "pred": "DepressedMonicEq",
          "args": [
            {
              "ref": "$input"
            },
            {
              "ref": "poly.g"
            }
          ]
        },
        "rule": "normalize.depressed_monic_QQ@1",
        "premises": [
          "F1"
        ],
        "evidence": {
          "monic_scale": "1",
          "tschirnhaus_shift": "1"
        }
      },
      {
        "id": "F3",
        "claim": {
          "pred": "Degree",
          "args": [
            {
              "ref": "poly.g"
            },
            {
              "ref": "int.2"
            }
          ]
        },
        "rule": "degree.QQ@1"
      },
      {
        "id": "F4",
        "claim": {
          "pred": "IrreducibleQQ",
          "args": [
            {
              "ref": "poly.g"
            }
          ]
        },
        "rule": "irreducible.QQ.deg5_recompute@1",
        "premises": [
          "F3"
        ]
      },
      {
        "id": "F5",
        "claim": {
          "pred": "GaloisGroup",
          "args": [
            {
              "ref": "poly.g"
            },
            {
              "ref": "grp.C2"
            }
          ]
        },
        "rule": "galois_group.QQ.deg2.C2@1",
        "premises": [
          "F3",
          "F4"
        ]
      },
      {
        "id": "F6",
        "claim": {
          "pred": "GaloisGroup",
          "args": [
            {
              "ref": "$input"
            },
            {
              "ref": "grp.C2"
            }
          ]
        },
        "rule": "galois_group.QQ.lift.depressed_monic@1",
        "premises": [
          "F2",
          "F5"
        ]
      }
    ]
  }
}