{
  "$schema": "https://opengalois.org/schemas/certificate/3.0.0.json",
  "input": {
    "canonicalization": "jcs-rfc8785",
    "coeffs_qq": [
      "1",
      "0",
      "1"
    ],
    "degree": 2,
    "domain": "Q",
    "hash": "096da3b46b34fb1c5855ece717f2afc205027bb12019b78a07770b5b78495f6a",
    "hash_alg": "sha256",
    "hash_scope": "input_v1",
    "ordering": "descending_degree",
    "variable": "x"
  },
  "meta": {
    "backend": "none",
    "generator": "opengalois",
    "generator_version": "0.0.0-dev",
    "ruleset_id": "le5-core@1",
    "schema_version": "3.0.0"
  },
  "objects": {
    "rat.D": {
      "kind": "RatQQ",
      "value": "-4"
    }
  },
  "proof": {
    "version": "1.0",
    "facts": [
      {
        "id": "F1",
        "claim": {
          "pred": "Discriminant",
          "args": [
            {
              "ref": "$input"
            },
            {
              "ref": "rat.D"
            }
          ]
        },
        "premises": [],
        "rule": "disc.QQ.compute@1",
        "statement": "Discriminant of x^2+1 is -4."
      },
      {
        "id": "F2",
        "claim": {
          "pred": "NonSquareQQ",
          "args": [
            {
              "ref": "rat.D"
            }
          ]
        },
        "premises": [],
        "rule": "nonsquare.QQ.isqrt@1",
        "statement": "-4 is not a square in QQ."
      },
      {
        "id": "F3",
        "claim": {
          "pred": "DiscNonSquareQQ",
          "args": [
            {
              "ref": "$input"
            }
          ]
        },
        "premises": [
          "F1",
          "F2"
        ],
        "rule": "disc.nonsquare.QQ.lift@1",
        "statement": "Discriminant of f is not a square in QQ."
      }
    ]
  },
  "summary": {
    "status": "ok"
  }
}
