{
  "$schema": "https://opengalois.org/schemas/certificate/3.0.0.json",
  "meta": {
    "schema_version": "3.0.0",
    "generator": "opengalois",
    "generator_version": "0.0.0",
    "backend": "sympy",
    "ruleset_id": "le5-core@1"
  },
  "input": {
    "domain": "Q",
    "variable": "x",
    "ordering": "descending_degree",
    "degree": 5,
    "coeffs_qq": [
      "1",
      "-1",
      "-10",
      "10",
      "16",
      "-16"
    ],
    "canonicalization": "jcs-rfc8785",
    "hash_alg": "sha256",
    "hash_scope": "input_v1",
    "hash": "088c73c553bb1fcb3a626fd85a5dd886b0afdea3b79f1458752d3f7ba264f805"
  },
  "objects": {
    "poly:q1": {
      "kind": "PolyQQ",
      "coeffs_qq": [
        "1",
        "0",
        "-2"
      ]
    },
    "poly:q2": {
      "kind": "PolyQQ",
      "coeffs_qq": [
        "1",
        "0",
        "-8"
      ]
    },
    "list:factors": {
      "kind": "PolyQQList",
      "items": [
        "poly:l1",
        "poly:q1",
        "poly:q2"
      ]
    },
    "rat:unit": {
      "kind": "RatQQ",
      "value": "1"
    },
    "int:2": {
      "kind": "IntZ",
      "value": "2"
    },
    "rat:d1": {
      "kind": "RatQQ",
      "value": "8"
    },
    "rat:d2": {
      "kind": "RatQQ",
      "value": "32"
    },
    "rat:prod": {
      "kind": "RatQQ",
      "value": "256"
    },
    "rat:prod_sqrt": {
      "kind": "RatQQ",
      "value": "16"
    },
    "grp:C2": {
      "kind": "GroupId",
      "system": "smallgroup",
      "order": 2,
      "index": 1,
      "alias": "C2"
    },
    "poly:l1": {
      "kind": "PolyQQ",
      "coeffs_qq": [
        "1",
        "-1"
      ]
    },
    "int:1": {
      "kind": "IntZ",
      "value": "1"
    }
  },
  "proof": {
    "version": "1.0",
    "facts": [
      {
        "id": "F1",
        "claim": {
          "pred": "Degree",
          "args": [
            {
              "ref": "poly:q1"
            },
            {
              "ref": "int:2"
            }
          ]
        },
        "rule": "degree.QQ@1",
        "premises": []
      },
      {
        "id": "F2",
        "claim": {
          "pred": "IrreducibleQQ",
          "args": [
            {
              "ref": "poly:q1"
            }
          ]
        },
        "rule": "irreducible.QQ.deg5_recompute@1",
        "premises": [
          "F1"
        ]
      },
      {
        "id": "F3",
        "claim": {
          "pred": "Discriminant",
          "args": [
            {
              "ref": "poly:q1"
            },
            {
              "ref": "rat:d1"
            }
          ]
        },
        "rule": "disc.QQ.compute@1",
        "premises": []
      },
      {
        "id": "F4",
        "claim": {
          "pred": "Degree",
          "args": [
            {
              "ref": "poly:q2"
            },
            {
              "ref": "int:2"
            }
          ]
        },
        "rule": "degree.QQ@1",
        "premises": []
      },
      {
        "id": "F5",
        "claim": {
          "pred": "IrreducibleQQ",
          "args": [
            {
              "ref": "poly:q2"
            }
          ]
        },
        "rule": "irreducible.QQ.deg5_recompute@1",
        "premises": [
          "F4"
        ]
      },
      {
        "id": "F6",
        "claim": {
          "pred": "Discriminant",
          "args": [
            {
              "ref": "poly:q2"
            },
            {
              "ref": "rat:d2"
            }
          ]
        },
        "rule": "disc.QQ.compute@1",
        "premises": []
      },
      {
        "id": "F7",
        "claim": {
          "pred": "SqrtQQ",
          "args": [
            {
              "ref": "rat:prod"
            },
            {
              "ref": "rat:prod_sqrt"
            }
          ]
        },
        "rule": "sqrt.QQ.check@1",
        "premises": []
      },
      {
        "id": "F8",
        "claim": {
          "pred": "IsSquareQQ",
          "args": [
            {
              "ref": "rat:prod"
            }
          ]
        },
        "rule": "is_square.QQ.lift@1",
        "premises": [
          "F7"
        ]
      },
      {
        "id": "F9",
        "claim": {
          "pred": "FactorizationMonicQQ",
          "args": [
            {
              "ref": "$input"
            },
            {
              "ref": "list:factors"
            },
            {
              "ref": "rat:unit"
            }
          ]
        },
        "rule": "factorization.QQ.monic@1",
        "premises": []
      },
      {
        "id": "F9L",
        "claim": {
          "pred": "Degree",
          "args": [
            {
              "ref": "poly:l1"
            },
            {
              "ref": "int:1"
            }
          ]
        },
        "rule": "degree.QQ@1",
        "premises": []
      },
      {
        "id": "F10",
        "claim": {
          "pred": "GaloisGroup",
          "args": [
            {
              "ref": "$input"
            },
            {
              "ref": "grp:C2"
            }
          ]
        },
        "rule": "galois_group.QQ.reducible.double_quadratic.C2@1",
        "premises": [
          "F9",
          "F1",
          "F2",
          "F3",
          "F4",
          "F5",
          "F6",
          "F8",
          "F9L"
        ]
      }
    ]
  }
}
