{
  "$schema": "https://opengalois.org/schemas/certificate/3.0.0.json",
  "meta": {
    "schema_version": "3.0.0",
    "generator": "fixture",
    "generator_version": "0",
    "backend": "none",
    "ruleset_id": "le5-core@1"
  },
  "input": {
    "domain": "Q",
    "variable": "x",
    "ordering": "descending_degree",
    "degree": 4,
    "coeffs_qq": [
      "1",
      "0",
      "0",
      "8",
      "12"
    ],
    "canonicalization": "jcs-rfc8785",
    "hash_alg": "sha256",
    "hash_scope": "input_v1",
    "hash": "fb51b1a27fc3e4a917035d1d19c2628106c76948be2ccc2d81278c55a3f0dffb"
  },
  "objects": {
    "int.deg4": {
      "kind": "IntZ",
      "value": "4"
    },
    "int.deg3": {
      "kind": "IntZ",
      "value": "3"
    },
    "rat.disc.1": {
      "kind": "RatQQ",
      "value": "331776"
    },
    "poly.resolvent.1": {
      "kind": "PolyQQ",
      "coeffs_qq": [
        "1",
        "0",
        "-48",
        "-64"
      ]
    },
    "mpoly.resolvent.deg4.cubic_x1x2_plus_x3x4": {
      "kind": "MPolyQQ",
      "nvars": 4,
      "terms": [
        {
          "exp": [
            1,
            1,
            0,
            0
          ],
          "coeff_qq": "1"
        },
        {
          "exp": [
            0,
            0,
            1,
            1
          ],
          "coeff_qq": "1"
        }
      ]
    },
    "grp.target": {
      "kind": "GroupId",
      "system": "smallgroup",
      "order": 12,
      "index": 3,
      "alias": "A4"
    },
    "rat.sqrt.1": {
      "kind": "RatQQ",
      "value": "576"
    }
  },
  "proof": {
    "version": "1.0",
    "facts": [
      {
        "id": "F1",
        "claim": {
          "pred": "Degree",
          "args": [
            {
              "ref": "$input"
            },
            {
              "ref": "int.deg4"
            }
          ]
        },
        "rule": "degree.QQ@1",
        "premises": [],
        "statement": "Degree of the input quartic."
      },
      {
        "id": "F2",
        "claim": {
          "pred": "IrreducibleQQ",
          "args": [
            {
              "ref": "$input"
            }
          ]
        },
        "rule": "irreducible.QQ.deg5_recompute@1",
        "premises": [
          "F1"
        ],
        "statement": "Irreducible quartic over QQ."
      },
      {
        "id": "F3",
        "claim": {
          "pred": "Discriminant",
          "args": [
            {
              "ref": "$input"
            },
            {
              "ref": "rat.disc.1"
            }
          ]
        },
        "rule": "disc.QQ.compute@1",
        "premises": [],
        "statement": "Quartic discriminant."
      },
      {
        "id": "F4",
        "claim": {
          "pred": "SqrtQQ",
          "args": [
            {
              "ref": "rat.disc.1"
            },
            {
              "ref": "rat.sqrt.1"
            }
          ]
        },
        "rule": "sqrt.QQ.check@1",
        "premises": [],
        "statement": "Square root witness for the discriminant."
      },
      {
        "id": "F5",
        "claim": {
          "pred": "IsSquareQQ",
          "args": [
            {
              "ref": "rat.disc.1"
            }
          ]
        },
        "rule": "is_square.QQ.lift@1",
        "premises": [
          "F4"
        ],
        "statement": "Discriminant is a square in QQ."
      },
      {
        "id": "F6",
        "claim": {
          "pred": "DiscSquareQQ",
          "args": [
            {
              "ref": "$input"
            }
          ]
        },
        "rule": "disc.square.QQ.lift@1",
        "premises": [
          "F3",
          "F5"
        ],
        "statement": "Quartic discriminant square branch."
      },
      {
        "id": "F7",
        "claim": {
          "pred": "Degree",
          "args": [
            {
              "ref": "poly.resolvent.1"
            },
            {
              "ref": "int.deg3"
            }
          ]
        },
        "rule": "degree.QQ@1",
        "premises": [],
        "statement": "Degree of the quartic cubic resolvent."
      },
      {
        "id": "F8",
        "claim": {
          "pred": "ResolventQQ",
          "args": [
            {
              "ref": "poly.resolvent.1"
            },
            {
              "ref": "$input"
            },
            {
              "ref": "mpoly.resolvent.deg4.cubic_x1x2_plus_x3x4"
            }
          ]
        },
        "rule": "resolvent.QQ.compute.deg4.cubic_x1x2_plus_x3x4@1",
        "premises": [
          "F1"
        ],
        "statement": "Quartic cubic resolvent."
      },
      {
        "id": "F9",
        "claim": {
          "pred": "IrreducibleQQ",
          "args": [
            {
              "ref": "poly.resolvent.1"
            }
          ]
        },
        "rule": "irreducible.QQ.deg5_recompute@1",
        "premises": [
          "F7"
        ],
        "statement": "Irreducible cubic resolvent over QQ."
      },
      {
        "id": "F10",
        "claim": {
          "pred": "GaloisGroup",
          "args": [
            {
              "ref": "$input"
            },
            {
              "ref": "grp.target"
            }
          ]
        },
        "rule": "galois_group.QQ.deg4.A4@1",
        "premises": [
          "F1",
          "F2",
          "F6",
          "F8",
          "F9"
        ],
        "statement": "Quartic Galois-group classification."
      }
    ]
  }
}