{
  "$schema": "https://opengalois.org/schemas/certificate/3.0.0.json",
  "meta": {
    "schema_version": "3.0.0",
    "generator": "opengalois",
    "generator_version": "0.0.0",
    "backend": "sympy",
    "ruleset_id": "le5-core@1"
  },
  "input": {
    "domain": "Q",
    "variable": "x",
    "ordering": "descending_degree",
    "degree": 5,
    "coeffs_qq": [
      "1",
      "0",
      "-24",
      "-1",
      "23",
      "23"
    ],
    "canonicalization": "jcs-rfc8785",
    "hash_alg": "sha256",
    "hash_scope": "input_v1",
    "hash": "652a9f1cd86b6ac13431711fbc5a205dd4bb01de903bd127fe0247d94a0591ff"
  },
  "objects": {
    "poly:q": {
      "kind": "PolyQQ",
      "coeffs_qq": [
        "1",
        "0",
        "-23"
      ]
    },
    "poly:c": {
      "kind": "PolyQQ",
      "coeffs_qq": [
        "1",
        "0",
        "-1",
        "-1"
      ]
    },
    "list:factors": {
      "kind": "PolyQQList",
      "items": [
        "poly:q",
        "poly:c"
      ]
    },
    "rat:unit": {
      "kind": "RatQQ",
      "value": "1"
    },
    "int:2": {
      "kind": "IntZ",
      "value": "2"
    },
    "int:3": {
      "kind": "IntZ",
      "value": "3"
    },
    "rat:d1": {
      "kind": "RatQQ",
      "value": "92"
    },
    "rat:d2": {
      "kind": "RatQQ",
      "value": "-23"
    },
    "rat:w": {
      "kind": "RatQQ",
      "value": "-2116"
    },
    "grp:D6": {
      "kind": "GroupId",
      "system": "smallgroup",
      "order": 12,
      "index": 4,
      "alias": "D6"
    }
  },
  "proof": {
    "version": "1.0",
    "facts": [
      {
        "id": "F1",
        "claim": {
          "pred": "Degree",
          "args": [
            { "ref": "poly:q" },
            { "ref": "int:2" }
          ]
        },
        "rule": "degree.QQ@1",
        "premises": []
      },
      {
        "id": "F2",
        "claim": {
          "pred": "IrreducibleQQ",
          "args": [
            { "ref": "poly:q" }
          ]
        },
        "rule": "irreducible.QQ.deg5_recompute@1",
        "premises": [
          "F1"
        ]
      },
      {
        "id": "F3",
        "claim": {
          "pred": "Degree",
          "args": [
            { "ref": "poly:c" },
            { "ref": "int:3" }
          ]
        },
        "rule": "degree.QQ@1",
        "premises": []
      },
      {
        "id": "F4",
        "claim": {
          "pred": "IrreducibleQQ",
          "args": [
            { "ref": "poly:c" }
          ]
        },
        "rule": "irreducible.QQ.deg5_recompute@1",
        "premises": [
          "F3"
        ]
      },
      {
        "id": "F5",
        "claim": {
          "pred": "FactorizationMonicQQ",
          "args": [
            { "ref": "$input" },
            { "ref": "list:factors" },
            { "ref": "rat:unit" }
          ]
        },
        "rule": "factorization.QQ.monic@1",
        "premises": []
      },
      {
        "id": "F6",
        "claim": {
          "pred": "Discriminant",
          "args": [
            { "ref": "poly:q" },
            { "ref": "rat:d1" }
          ]
        },
        "rule": "disc.QQ.compute@1",
        "premises": []
      },
      {
        "id": "F7",
        "claim": {
          "pred": "Discriminant",
          "args": [
            { "ref": "poly:c" },
            { "ref": "rat:d2" }
          ]
        },
        "rule": "disc.QQ.compute@1",
        "premises": []
      },
      {
        "id": "F8",
        "claim": {
          "pred": "NonSquareQQ",
          "args": [
            { "ref": "rat:d2" }
          ]
        },
        "rule": "nonsquare.QQ.isqrt@1",
        "premises": []
      },
      {
        "id": "F9",
        "claim": {
          "pred": "NonSquareQQ",
          "args": [
            { "ref": "rat:w" }
          ]
        },
        "rule": "nonsquare.QQ.isqrt@1",
        "premises": []
      },
      {
        "id": "F10",
        "claim": {
          "pred": "GaloisGroup",
          "args": [
            { "ref": "$input" },
            { "ref": "grp:D6" }
          ]
        },
        "rule": "galois_group.QQ.reducible.quadratic_cubic.D6@2",
        "premises": [
          "F5",
          "F1",
          "F2",
          "F3",
          "F4",
          "F6",
          "F7",
          "F8",
          "F9"
        ]
      }
    ],
    "goals": [
      "F10"
    ]
  }
}