{
  "$schema": "https://opengalois.org/schemas/certificate/3.0.0.json",
  "input": {
    "canonicalization": "jcs-rfc8785",
    "coeffs_qq": [
      "1",
      "0",
      "-1",
      "2",
      "0",
      "-3"
    ],
    "degree": 5,
    "domain": "Q",
    "hash": "962ffcd01e84291e76264789e4dbe89e9448322d882a21d6c7e52d236ef2bc6a",
    "hash_alg": "sha256",
    "hash_scope": "input_v1",
    "ordering": "descending_degree",
    "variable": "x"
  },
  "meta": {
    "backend": "none",
    "generator": "opengalois",
    "generator_version": "0.0.0-dev",
    "ruleset_id": "le5-core@1",
    "schema_version": "3.0.0"
  },
  "objects": {
    "int.5": {
      "kind": "IntZ",
      "value": "5"
    }
  },
  "proof": {
    "facts": [
      {
        "claim": {
          "args": [
            {
              "ref": "$input"
            },
            {
              "ref": "int.5"
            }
          ],
          "pred": "Degree"
        },
        "id": "F1",
        "premises": [],
        "rule": "degree.QQ@1",
        "statement": "The input polynomial has degree 5."
      }
    ],
    "version": "1.0"
  },
  "summary": {
    "status": "ok"
  }
}